id,abstract_inverted_index,abs,abstract,abstract_sm
https://openalex.org/W1842793959,"{'Based': [0], 'on': [1, 115], 'nationally': [2], 'representative': [3], 'data': [4], 'from': [5], 'the': [6, 11, 19, 27, 37, 46, 49, 52, 59, 68, 90, 103, 120], 'German': [7], 'Socio-Economic': [8], 'Panel': [9, 12, 22], '(SOEP),': [10], 'Study': [13], 'of': [14, 30, 54, 62, 105, 123], 'Income': [15], 'Dynamics': [16], '(PSID),': [17], 'and': [18, 32, 40, 51, 58, 76, 96, 99, 107, 111, 119], 'British': [20], 'Household': [21], 'Survey': [23], '(BHPS)': [24], 'we': [25], 'analyze': [26], 'intergenerational': [28, 55, 86, 116], 'transmission': [29], 'economic': [31], 'social': [33, 77, 112], '(dis-)advantages': [34], 'in': [35, 89, 94], 'Germany,': [36], 'United': [38, 91], 'States': [39, 92], 'Great': [41, 97], 'Britain.': [42], 'We': [43], 'test': [44], 'with': [45, 65], 'hypotheses': [47], 'that': [48], 'extent': [50], 'determinants': [53], 'income': [56, 87, 117], 'mobility': [57, 118], 'relative': [60, 121], 'risk': [61, 122], 'poverty': [63], 'differ': [64], 'respect': [66], 'to': [67], 'existing': [69], 'welfare': [70], 'state': [71], 'regime,': [72], 'family': [73], 'role': [74], 'patterns,': [75], 'policy': [78], 'design.': [79], 'The': [80], 'empirical': [81], 'results': [82], 'indicate': [83], 'a': [84], 'higher': [85], 'elasticity': [88], 'than': [93], 'Germany': [95], 'Britain,': [98], 'country': [100], 'differences': [101], 'concerning': [102], 'influence': [104], 'individual': [106], 'parental': [108], 'socio-economic': [109], 'characteristics,': [110], 'exclusion': [113], 'attributes': [114], 'poverty.': [124]}","Based on nationally representative data from the German Socio-Economic Panel (SOEP), the Panel Study of Income Dynamics (PSID), and the British Household Panel Survey (BHPS) we analyze the intergenerational transmission of economic and social (dis-)advantages in Germany, the United States and Great Britain. We test with the hypotheses that the extent and the determinants of intergenerational income mobility and the relative risk of poverty differ with respect to the existing welfare state regime, family role patterns, and social policy design. The empirical results indicate a higher intergenerational income elasticity in the United States than in Germany and Great Britain, and country differences concerning the influence of individual and parental socio-economic characteristics, and social exclusion attributes on intergenerational income mobility and the relative risk of poverty.","Based on nationally representative data from the German Socio-Economic Panel (SOEP), the Panel Study of Income Dynamics (PSID), and the British Household Panel Survey (BHPS) we analyze the intergenerational transmission of economic and social (dis-)advantages in Germany, the United States and Great Britain. We test with the hypotheses that the extent and the determinants of intergenerational income mobility and the relative risk of poverty differ with respect to the existing welfare state regime, family role patterns, and social policy design. The empirical results indicate a higher intergenerational income elasticity in the United States than in Germany and Great Britain, and country differences concerning the influence of individual and parental socio-economic characteristics, and social exclusion attributes on intergenerational income mobility and the relative risk of poverty.","Based on nationally representative data from the German Socio-Economic Panel (SOEP), the Panel Study of Income Dynamics (PSID), and the British Household Panel Survey (BHPS) we analyze the intergenerational transmission of economic and social (dis-)advantages in Germany, the United States and Great Britain. We test with the hypotheses that the extent and the determinants of intergenerational income mobility and the relative risk of poverty differ with respect to the existing welfare state regime, family role patterns, and social policy design. The empirical results indicate a higher intergenerational income elasticity in the United States than in Germany and Great Britain, and country differences concerning the influence of individual and parental socio-economic characteristics, and social exclusion attributes on intergenerational income mobility and the relative risk of poverty."
https://openalex.org/W200323859,"{'This': [0, 163], 'dissertation': [1], 'consists': [2], 'of': [3, 54, 78, 95, 114, 134, 149, 169, 186, 202, 210, 244, 256, 258, 272, 304, 332, 354, 393], 'three': [4, 26], 'essays,': [5], 'taking': [6], 'different': [7], 'perspectives': [8], 'on': [9, 28, 46, 151, 213, 234, 253, 269, 402], 'human': [10, 17, 58, 69, 109, 183, 308], 'capital.': [11, 110], 'The': [12, 315, 371, 391], 'first': [13, 39], 'essay': [14, 40, 300, 345], 'looks': [15], 'at': [16], 'capital': [18, 59, 70, 116, 136, 184, 197, 309], 'from': [19, 356, 387], 'a': [20, 131, 245, 302, 406], 'growth': [21, 50, 100, 139], 'perspective.': [22], 'Essays': [23], 'two': [24], 'and': [25, 33, 51, 60, 80, 215, 228, 249, 265, 268, 286, 297, 307, 313, 334, 399], 'focuses': [27], 'the': [29, 44, 55, 76, 93, 104, 118, 127, 143, 146, 152, 167, 208, 242, 254, 270, 293, 394], 'individual’s': [30], 'occupational': [31, 200, 236, 305, 322], 'decision': [32], 'its': [34, 124, 232], 'relation': [35], 'to': [36, 42, 107, 120, 126, 159, 175, 180, 181, 196, 204, 262, 320, 326, 338, 341, 363, 380], 'family': [37, 176, 318], 'background.The': [38], 'attempts': [41], 'capture': [43], 'effects': [45, 209], 'long': [47, 98], 'run': [48, 99], 'economic': [49, 327, 364, 381], 'transitional': [52], 'dynamics': [53], 'interaction': [56], 'between': [57, 247], 'R&D.': [61, 88], 'We': [62, 89, 206], 'do': [63, 87], 'this': [64, 189], 'by': [65, 103], 'allowing': [66], 'for': [67, 225, 292, 295, 414], 'endogenous': [68], 'accumulation': [71], 'in': [72, 92, 157, 194, 330, 344], 'an': [73, 281], 'economy': [74, 119], 'where': [75], 'number': [77], 'products': [79], 'technologies': [81], 'expands': [82], 'because': [83], 'profit': [84], 'maximizing': [85], 'entrepreneurs': [86], 'find': [90], 'that,': [91], 'absence': [94], 'scale': [96], 'effects,': [97], 'is': [101, 155, 164, 173, 219, 289, 311, 348, 360, 369], 'determined': [102], 'economy’s': [105], 'capacity': [106], 'accumulate': [108], 'A': [111], 'relative': [112, 132], 'lack': [113], 'R&D': [115, 135], 'causes': [117], 'grow': [121], 'slowly': [122], 'during': [123, 141], 'transition': [125], 'steady': [128], 'state,': [129], 'while': [130], 'abundance': [133], 'gives': [137], 'high': [138], 'rates': [140], 'transition.In': [142], 'second': [144], 'essay,': [145], 'classical': [147], 'Roy-model': [148], 'selection': [150], 'labor': [153], 'market': [154], 'extended': [156], 'order': [158], 'analyze': [160], 'intergenerational': [161, 187, 226, 250], 'mobility.': [162], 'done': [165], 'through': [166, 231, 324], 'introduction': [168], 'ability': [170, 263, 335, 416], 'uncertainty': [171, 336], 'that': [172, 221, 241, 342, 350, 375], 'linked': [174, 337], 'background.': [177], 'In': [178], 'contrast': [179], 'additional': [182], 'models': [185], 'mobility,': [188], 'mechanism': [190], 'rather': [191], 'than': [192], 'differences': [193, 329], 'access': [195, 325], 'markets': [198], 'links': [199], 'oucomes': [201], 'offspring': [203], 'parents.': [205], 'study': [207], 'income': [211], 'redistribution': [212, 222, 248, 277], 'mobility': [214, 227, 251, 296], 'talent': [216, 229, 298], 'allocation.': [217], 'It': [218, 347], 'found': [220], 'has': [223], 'implications': [224, 392], 'allocation': [230], 'influence': [233, 321], 'individual': [235, 273], 'choices.': [237], 'However,': [238], 'we': [239], 'conclude': [240], 'presence': [243], 'trade-off': [246], 'depends': [252], 'extent': [255], 'similarity': [257], 'occupations': [259, 288, 385], 'with': [260], 'regard': [261], 'sensitivity': [264], 'wage': [266], 'rates,': [267], 'degree': [271], 'risk': [274, 367], 'aversion.': [275], 'Whether': [276], 'occurs': [278], 'only': [279], 'within': [280, 285], 'occupation': [282], 'or': [283], 'simultaneously': [284], 'across': [287], 'also': [290, 373], 'inportant': [291], 'implicatons': [294], 'allocation.In': [299], 'three,': [301], 'model': [303, 316, 372, 396], 'choice': [306, 323], 'investment': [310], 'developmed': [312], 'tested.': [314], 'allows': [317], 'background': [319, 339, 359], 'resources,': [328], 'costs': [331], 'schooling,': [333], 'similar': [340], 'discussed': [343], 'two.': [346], 'predicted': [349], 'life': [351], 'time': [352], 'utility': [353], 'children': [355], 'less': [357], 'well-off': [358], 'more': [361, 378], 'sensitive': [362, 379], 'incentives': [365, 382], 'when': [366, 383], 'aversion': [368], 'strong.': [370], 'predicts': [374], 'people': [376], 'are': [377, 397], 'considering': [384], 'distant': [386], 'their': [388], 'parent': [389], 'occuations.': [390], 'theoretical': [395], 'tested': [398], 'largely': [400], 'confirmed': [401], 'Swedish': [403], 'data': [404], 'using': [405], 'mixed': [407], 'multinominal': [408], 'logit': [409], 'framework': [410], 'which': [411], 'explicitly': [412], 'accounts': [413], 'unobserved': [415], 'heterogeneity.': [417]}","This dissertation consists of three essays, taking different perspectives on human capital. The first essay looks at human capital from a growth perspective. Essays two and three focuses on the individual’s occupational decision and its relation to family background.The first essay attempts to capture the effects on long run economic growth and transitional dynamics of the interaction between human capital and R&D. We do this by allowing for endogenous human capital accumulation in an economy where the number of products and technologies expands because profit maximizing entrepreneurs do R&D. We find that, in the absence of scale effects, long run growth is determined by the economy’s capacity to accumulate human capital. A relative lack of R&D capital causes the economy to grow slowly during its transition to the steady state, while a relative abundance of R&D capital gives high growth rates during transition.In the second essay, the classical Roy-model of selection on the labor market is extended in order to analyze intergenerational mobility. This is done through the introduction of ability uncertainty that is linked to family background. In contrast to to additional human capital models of intergenerational mobility, this mechanism rather than differences in access to capital markets links occupational oucomes of offspring to parents. We study the effects of income redistribution on mobility and talent allocation. It is found that redistribution has implications for intergenerational mobility and talent allocation through its influence on individual occupational choices. However, we conclude that the presence of a trade-off between redistribution and intergenerational mobility depends on the extent of similarity of occupations with regard to ability sensitivity and wage rates, and on the degree of individual risk aversion. Whether redistribution occurs only within an occupation or simultaneously within and across occupations is also inportant for the implicatons for mobility and talent allocation.In essay three, a model of occupational choice and human capital investment is developmed and tested. The model allows family background to influence occupational choice through access to economic resources, differences in costs of schooling, and ability uncertainty linked to background similar to that discussed in essay two. It is predicted that life time utility of children from less well-off background is more sensitive to economic incentives when risk aversion is strong. The model also predicts that people are more sensitive to economic incentives when considering occupations distant from their parent occuations. The implications of the theoretical model are tested and largely confirmed on Swedish data using a mixed multinominal logit framework which explicitly accounts for unobserved ability heterogeneity.","This dissertation consists of three essays, taking different perspectives on human capital. The first essay looks at human capital from a growth perspective. Essays two and three focuses on the individual’s occupational decision and its relation to family background.The first essay attempts to capture the effects on long run economic growth and transitional dynamics of the interaction between human capital and R&D. We do this by allowing for endogenous human capital accumulation in an economy where the number of products and technologies expands because profit maximizing entrepreneurs do R&D. We find that, in the absence of scale effects, long run growth is determined by the economy’s capacity to accumulate human capital. A relative lack of R&D capital causes the economy to grow slowly during its transition to the steady state, while a relative abundance of R&D capital gives high growth rates during transition.In the second essay, the classical Roy-model of selection on the labor market is extended in order to analyze intergenerational mobility. This is done through the introduction of ability uncertainty that is linked to family background. In contrast to to additional human capital models of intergenerational mobility, this mechanism rather than differences in access to capital markets links occupational oucomes of offspring to parents. We study the effects of income redistribution on mobility and talent allocation. It is found that redistribution has implications for intergenerational mobility and talent allocation through its influence on individual occupational choices. However, we conclude that the presence of a trade-off between redistribution and intergenerational mobility depends on the extent of similarity of occupations with regard to ability sensitivity and wage rates, and on the degree of individual risk aversion. Whether redistribution occurs only within an occupation or simultaneously within and across occupations is also inportant for the implicatons for mobility and talent allocation.In essay three, a model of occupational choice and human capital investment is developmed and tested. The model allows family background to influence occupational choice through access to economic resources, differences in costs of schooling, and ability uncertainty linked to background similar to that discussed in essay two. It is predicted that life time utility of children from less well-off background is more sensitive to economic incentives when risk aversion is strong. The model also predicts that people are more sensitive to economic incentives when considering occupations distant from their parent occuations. The implications of the theoretical model are tested and largely confirmed on Swedish data using a mixed multinominal logit framework which explicitly accounts for unobserved ability heterogeneity.",
https://openalex.org/W2034641041,"{'Tertiary': [0, 14], 'education': [1, 15], 'in': [2, 39], 'the': [3, 22, 81, 105], 'U.S.': [4], 'requires': [5], 'large': [6], 'investments': [7], 'that': [8, 72, 89], 'are': [9, 61], 'risky,': [10], 'lumpy,': [11], 'and': [12, 45, 60, 110, 116], 'well-timed.': [13], 'is': [16], 'also': [17, 52], 'heavily': [18], 'subsidized.': [19], 'By': [20], 'making': [21], 'risk': [23], 'of': [24, 107], 'human': [25, 40], 'capital': [26], 'investment': [27, 38], 'more': [28, 54], 'acceptable,': [29], 'especially': [30], 'to': [31, 58, 80], 'low': [32], 'wealth': [33], 'households,': [34], 'subsidies': [35, 51, 75, 90], 'may': [36], 'increase': [37, 97, 112], 'capital,': [41], 'lower': [42, 94, 104], 'long-run': [43], 'inequality,': [44], 'reduce': [46], 'aggregate': [47], 'precautionary': [48, 101], 'savings.': [49], 'However,': [50], 'encourage': [53], 'poorly': [55], 'prepared': [56], 'students': [57], 'attend': [59], 'usually': [62], 'financed': [63, 121], 'via': [64], 'distortionary': [65, 123], 'taxes.': [66, 124], 'In': [67], 'this': [68], 'paper,': [69], 'we': [70], 'find': [71], 'observed': [73], 'collegiate': [74], 'improve': [76], 'welfare': [77], 'substantially': [78], 'relative': [79], 'fully': [82], 'decentralized': [83], '(zero': [84], 'subsidy)': [85], 'outcome.': [86], 'We': [87], 'show': [88], 'help': [91], 'smooth': [92], 'consumption,': [93], 'skill': [95], 'premia,': [96], 'interest': [98], 'rates': [99], 'as': [100], 'savings': [102], 'fall,': [103], 'inequality': [106], 'both': [108], 'consumption': [109], 'wealth,': [111], 'intergenerational': [113], 'income': [114], 'mobility': [115], 'raise': [117], 'welfare,': [118], 'even': [119], 'when': [120], 'by': [122]}","Tertiary education in the U.S. requires large investments that are risky, lumpy, and well-timed. Tertiary education is also heavily subsidized. By making the risk of human capital investment more acceptable, especially to low wealth households, subsidies may increase investment in human capital, lower long-run inequality, and reduce aggregate precautionary savings. However, subsidies also encourage more poorly prepared students to attend and are usually financed via distortionary taxes. In this paper, we find that observed collegiate subsidies improve welfare substantially relative to the fully decentralized (zero subsidy) outcome. We show that subsidies help smooth consumption, lower skill premia, increase interest rates as precautionary savings fall, lower the inequality of both consumption and wealth, increase intergenerational income mobility and raise welfare, even when financed by distortionary taxes.","Tertiary education in the U.S. requires large investments that are risky, lumpy, and well-timed. Tertiary education is also heavily subsidized. By making the risk of human capital investment more acceptable, especially to low wealth households, subsidies may increase investment in human capital, lower long-run inequality, and reduce aggregate precautionary savings. However, subsidies also encourage more poorly prepared students to attend and are usually financed via distortionary taxes. In this paper, we find that observed collegiate subsidies improve welfare substantially relative to the fully decentralized (zero subsidy) outcome. We show that subsidies help smooth consumption, lower skill premia, increase interest rates as precautionary savings fall, lower the inequality of both consumption and wealth, increase intergenerational income mobility and raise welfare, even when financed by distortionary taxes.",Error fetching abstract
https://openalex.org/W2100541661,"{'In': [0, 48, 82], 'this': [1], 'paper,': [2], 'we': [3, 69, 84], 'abandon': [4], 'the': [5, 27, 35, 61, 93, 139, 158], 'stylized': [6], 'median': [7], 'voter': [8], 'and': [9, 25, 46, 145, 154], 'study': [10], '(i)': [11], 'how': [12, 60], 'distributional': [13], 'tensions': [14], 'can': [15, 97, 111], 'act': [16], 'in': [17, 51, 157], 'many': [18], 'different': [19, 36, 67], 'ways': [20], 'depending': [21], 'on': [22, 26, 129, 138], 'social': [23, 148], 'affinity': [24], 'prospect': [28], 'of': [29, 34, 142], 'upward': [30], 'or': [31, 57], 'downward': [32], 'mobility': [33], 'income': [37, 40, 143], 'classes,': [38], '(ii)': [39], 'distribution': [41, 144], 'dynamics,': [42], 'intergenerational': [43], 'community': [44], 'formation': [45], 'growth.': [47], 'a': [49, 86], 'world': [50], 'which': [52, 92, 127, 152], 'redistributive': [53, 119], 'policies,': [54], 'whether': [55], 'fiscal': [56], 'educational,': [58], 'affect': [59], 'entire': [62], 'economy': [63, 88], 'breaks': [64], 'up': [65], 'into': [66], 'communities,': [68], 'find': [70], 'multiple': [71, 124], 'politico-economic': [72], 'regimes': [73], 'that': [74], 'are': [75], 'supported': [76], 'by': [77], 'new': [78], 'international': [79], 'empirical': [80], 'evidence.': [81], 'particular,': [83], 'highlight': [85], 'political': [87], 'decision': [89], 'mechanism': [90], 'through': [91], 'pressure': [94], 'for': [95], 'redistribution': [96], 'be': [98, 112], 'highly': [99], 'non': [100], 'linear': [101], 'therefore': [102], 'providing': [103], 'an': [104], 'explanation': [105], 'as': [106], 'to': [107], 'why': [108], 'more': [109], 'inequality': [110, 153], 'associated': [113], 'with': [114], 'less,': [115], 'rather': [116], 'than': [117], 'more,': [118], 'taxation.': [120], 'Our': [121], 'framework': [122], 'displays': [123], 'steady': [125], 'states': [126], 'depend': [128], 'historical': [130], 'economic': [131], 'discrimination.': [132], 'We': [133], 'also': [134], 'provide': [135], 'sufficient': [136], 'conditions': [137], 'initial': [140], 'pattern': [141], 'local': [146], 'versus': [147], 'spillovers': [149], 'ratio': [150], 'under': [151], 'segregation': [155], 'persist': [156], 'long': [159], 'run.': [160]}","In this paper, we abandon the stylized median voter and study (i) how distributional tensions can act in many different ways depending on social affinity and on the prospect of upward or downward mobility of the different income classes, (ii) income distribution dynamics, intergenerational community formation and growth. In a world in which redistributive policies, whether fiscal or educational, affect how the entire economy breaks up into different communities, we find multiple politico-economic regimes that are supported by new international empirical evidence. In particular, we highlight a political economy decision mechanism through which the pressure for redistribution can be highly non linear therefore providing an explanation as to why more inequality can be associated with less, rather than more, redistributive taxation. Our framework displays multiple steady states which depend on historical economic discrimination. We also provide sufficient conditions on the initial pattern of income distribution and local versus social spillovers ratio under which inequality and segregation persist in the long run.","In this paper, we abandon the stylized median voter and study (i) how distributional tensions can act in many different ways depending on social affinity and on the prospect of upward or downward mobility of the different income classes, (ii) income distribution dynamics, intergenerational community formation and growth. In a world in which redistributive policies, whether fiscal or educational, affect how the entire economy breaks up into different communities, we find multiple politico-economic regimes that are supported by new international empirical evidence. In particular, we highlight a political economy decision mechanism through which the pressure for redistribution can be highly non linear therefore providing an explanation as to why more inequality can be associated with less, rather than more, redistributive taxation. Our framework displays multiple steady states which depend on historical economic discrimination. We also provide sufficient conditions on the initial pattern of income distribution and local versus social spillovers ratio under which inequality and segregation persist in the long run.",Error fetching abstract
