id,abstract_inverted_index,abs,abstract,abstract_sm
https://openalex.org/W3122978856,"{'Based': [0], 'on': [1, 115], 'nationally': [2], 'representative': [3], 'data': [4], 'from': [5], 'the': [6, 11, 19, 27, 37, 46, 49, 52, 59, 68, 90, 103, 120], 'German': [7], 'Socio-Economic': [8], 'Panel': [9, 12, 22], '(SOEP),': [10], 'Study': [13], 'of': [14, 30, 54, 62, 105, 123], 'Income': [15], 'Dynamics': [16], '(PSID),': [17], 'and': [18, 32, 40, 51, 58, 76, 96, 99, 107, 111, 119], 'British': [20], 'Household': [21], 'Survey': [23], '(BHPS)': [24], 'we': [25], 'analyze': [26], 'intergenerational': [28, 55, 86, 116], 'transmission': [29], 'economic': [31], 'social': [33, 77, 112], '(dis-)advantages': [34], 'in': [35, 89, 94], 'Germany,': [36], 'United': [38, 91], 'States': [39, 92], 'Great': [41, 97], 'Britain.': [42], 'We': [43], 'test': [44], 'with': [45, 65], 'hypotheses': [47], 'that': [48], 'extent': [50], 'determinants': [53], 'income': [56, 87, 117], 'mobility': [57, 118], 'relative': [60, 121], 'risk': [61, 122], 'poverty': [63], 'differ': [64], 'respect': [66], 'to': [67], 'existing': [69], 'welfare': [70], 'state': [71], 'regime,': [72], 'family': [73], 'role': [74], 'patterns,': [75], 'policy': [78], 'design.': [79], 'The': [80], 'empirical': [81], 'results': [82], 'indicate': [83], 'a': [84], 'higher': [85], 'elasticity': [88], 'than': [93], 'Germany': [95], 'Britain,': [98], 'country': [100], 'differences': [101], 'concerning': [102], 'influence': [104], 'individual': [106], 'parental': [108], 'socio-economic': [109], 'characteristics,': [110], 'exclusion': [113], 'attributes': [114], 'poverty.': [124]}","Based on nationally representative data from the German Socio-Economic Panel (SOEP), the Panel Study of Income Dynamics (PSID), and the British Household Panel Survey (BHPS) we analyze the intergenerational transmission of economic and social (dis-)advantages in Germany, the United States and Great Britain. We test with the hypotheses that the extent and the determinants of intergenerational income mobility and the relative risk of poverty differ with respect to the existing welfare state regime, family role patterns, and social policy design. The empirical results indicate a higher intergenerational income elasticity in the United States than in Germany and Great Britain, and country differences concerning the influence of individual and parental socio-economic characteristics, and social exclusion attributes on intergenerational income mobility and the relative risk of poverty.","Based on nationally representative data from the German Socio-Economic Panel (SOEP), the Panel Study of Income Dynamics (PSID), and the British Household Panel Survey (BHPS) we analyze the intergenerational transmission of economic and social (dis-)advantages in Germany, the United States and Great Britain. We test with the hypotheses that the extent and the determinants of intergenerational income mobility and the relative risk of poverty differ with respect to the existing welfare state regime, family role patterns, and social policy design. The empirical results indicate a higher intergenerational income elasticity in the United States than in Germany and Great Britain, and country differences concerning the influence of individual and parental socio-economic characteristics, and social exclusion attributes on intergenerational income mobility and the relative risk of poverty.",
https://openalex.org/W3123438904,"{'Studies': [0], 'of': [1, 12, 21, 32, 91, 123, 154], 'intergenerational': [2, 22, 73, 163], 'mobility': [3, 24, 52, 55, 100, 125, 129, 144], 'have': [4], 'largely': [5], 'ignored': [6], 'health': [7, 13, 23, 34, 51, 74, 83, 99, 110, 124, 143, 164], 'despite': [8], 'the': [9, 18, 26, 40, 57, 121], 'central': [10], 'importance': [11], 'to': [14, 157, 162], 'welfare.': [15], 'We': [16, 79, 94, 115, 149], 'present': [17], 'first': [19], 'estimates': [20], 'in': [25, 56, 98, 113, 120, 142], 'US': [27], 'by': [28, 101], 'using': [29], 'repeated': [30], 'measures': [31], 'self-reported': [33], 'status': [35], '(SRH)': [36], 'during': [37], 'adulthood': [38], 'from': [39], 'PSID.': [41], 'Our': [42], 'main': [43], 'finding': [44], 'is': [45, 48, 62], 'that': [46, 63, 82, 135], 'there': [47, 136], 'substantially': [49], 'greater': [50], 'than': [53, 76], 'income': [54, 77, 85, 128], 'US.': [58], 'A': [59], 'possible': [60], 'explanation': [61], 'social': [64, 92], 'institutions': [65], 'and': [66, 84, 109, 130], 'policies': [67], 'are': [68], 'more': [69, 146], 'effective': [70], 'at': [71], 'disrupting': [72], 'transmission': [75], 'transmission.': [78], 'further': [80], 'show': [81], 'each': [86], 'capture': [87], 'a': [88, 139, 151], 'distinct': [89], 'dimension': [90], 'mobility.': [93], 'also': [95, 131], 'characterize': [96], 'heterogeneity': [97], 'child': [102], 'gender,': [103, 105], 'parent': [104], 'race,': [106], 'education,': [107], 'geography': [108], 'insurance': [111], 'coverage': [112], 'childhood.': [114], 'find': [116, 132], 'some': [117, 133], 'important': [118], 'differences': [119], 'patterns': [122], 'compared': [126], 'with': [127], 'evidence': [134], 'has': [137], 'been': [138], 'notable': [140], 'decline': [141], 'for': [145], 'recent': [147], 'cohorts.': [148], 'use': [150], 'rich': [152], 'set': [153], 'background': [155], 'characteristics': [156], 'highlight': [158], 'potential': [159], 'mechanisms': [160], 'leading': [161], 'persistence.': [165]}","Studies of intergenerational mobility have largely ignored health despite the central importance of health to welfare. We present the first estimates of intergenerational health mobility in the US by using repeated measures of self-reported health status (SRH) during adulthood from the PSID. Our main finding is that there is substantially greater health mobility than income mobility in the US. A possible explanation is that social institutions and policies are more effective at disrupting intergenerational health transmission than income transmission. We further show that health and income each capture a distinct dimension of social mobility. We also characterize heterogeneity in health mobility by child gender, parent gender, race, education, geography and health insurance coverage in childhood. We find some important differences in the patterns of health mobility compared with income mobility and also find some evidence that there has been a notable decline in health mobility for more recent cohorts. We use a rich set of background characteristics to highlight potential mechanisms leading to intergenerational health persistence.","Studies of intergenerational mobility have largely ignored health despite the central importance of health to welfare. We present the first estimates of intergenerational health mobility in the US by using repeated measures of self-reported health status (SRH) during adulthood from the PSID. Our main finding is that there is substantially greater health mobility than income mobility in the US. A possible explanation is that social institutions and policies are more effective at disrupting intergenerational health transmission than income transmission. We further show that health and income each capture a distinct dimension of social mobility. We also characterize heterogeneity in health mobility by child gender, parent gender, race, education, geography and health insurance coverage in childhood. We find some important differences in the patterns of health mobility compared with income mobility and also find some evidence that there has been a notable decline in health mobility for more recent cohorts. We use a rich set of background characteristics to highlight potential mechanisms leading to intergenerational health persistence.",
https://openalex.org/W3124527946,"{'This': [0], 'paper': [1], 'presents': [2], 'new': [3], 'evidence': [4], 'on': [5], 'intergenerational': [6], 'income': [7], 'and': [8, 52], 'earnings': [9, 51], 'mobility': [10, 44, 74], 'in': [11, 25, 60], 'the': [12, 15, 41, 57, 61, 66, 78, 82], 'top': [13, 79], 'of': [14, 21, 40, 68, 81, 99, 105], 'distributions.': [16], 'Using': [17], 'a': [18, 95, 102], 'large': [19, 103], 'dataset': [20], 'matched': [22], 'father-son': [23], 'pairs': [24], 'Sweden': [26], 'we': [27, 71], 'are': [28], 'able': [29], 'to': [30, 55], 'obtain': [31], 'results': [32, 85], 'for': [33, 47, 50, 90, 101], 'fractions': [34], 'as': [35, 37], 'small': [36], '0.1': [38], 'percent': [39], 'population.': [42, 83], 'Overall,': [43], 'is': [45, 94], 'lower': [46], 'incomes': [48], 'than': [49], 'it': [53], 'appears': [54], 'decrease': [56], 'higher': [58], 'up': [59], 'distribution': [62], 'one': [63], 'goes.': [64], 'In': [65], 'case': [67], 'incomes,': [69], 'however,': [70], 'find': [72], 'that': [73, 87], 'decreases': [75], 'dramatically': [76], 'within': [77], 'percentile': [80], 'Our': [84], 'suggest': [86], 'Sweden,': [88], 'well-known': [89], 'its': [91], 'egalitarian': [92], 'achievements,': [93], 'society': [96], 'where': [97], 'equality': [98], 'opportunity': [100], 'majority': [104], 'wage': [106], 'earners': [107], 'coexists': [108], 'with': [109], 'capitalistic': [110], 'dynasties.': [111]}","This paper presents new evidence on intergenerational income and earnings mobility in the top of the distributions. Using a large dataset of matched father-son pairs in Sweden we are able to obtain results for fractions as small as 0.1 percent of the population. Overall, mobility is lower for incomes than for earnings and it appears to decrease the higher up in the distribution one goes. In the case of incomes, however, we find that mobility decreases dramatically within the top percentile of the population. Our results suggest that Sweden, well-known for its egalitarian achievements, is a society where equality of opportunity for a large majority of wage earners coexists with capitalistic dynasties.","This paper presents new evidence on intergenerational income and earnings mobility in the top of the distributions. Using a large dataset of matched father-son pairs in Sweden we are able to obtain results for fractions as small as 0.1 percent of the population. Overall, mobility is lower for incomes than for earnings and it appears to decrease the higher up in the distribution one goes. In the case of incomes, however, we find that mobility decreases dramatically within the top percentile of the population. Our results suggest that Sweden, well-known for its egalitarian achievements, is a society where equality of opportunity for a large majority of wage earners coexists with capitalistic dynasties.",Error fetching abstract
https://openalex.org/W3140473685,"{'We': [0, 40, 163], 'develop': [1], 'a': [2, 55, 68, 85, 137], 'quantitative': [3, 52], 'theory': [4, 26, 120, 150], 'of': [5, 17, 24, 36, 59, 63, 70, 87, 114, 139, 157], 'human': [6, 37, 80, 128, 131, 145], 'capital': [7, 38, 81, 129, 132, 146], 'with': [8, 153], 'heterogeneous': [9], 'agents': [10], 'in': [11, 73, 90, 97, 108, 111, 144, 159], 'order': [12], 'to': [13, 32, 46, 83, 126], 'assess': [14, 42], 'the': [15, 25, 34, 43, 48, 98, 112, 149, 160], 'sources': [16], 'cross-country': [18, 49, 142], 'income': [19], 'differences.': [20], 'The': [21, 105, 119, 141], 'cross-sectional': [22, 172], 'implications': [23], 'and': [27, 79, 102, 174, 177, 186], 'U.S.': [28], 'data': [29, 99], 'are': [30, 151], 'used': [31], 'restrict': [33], 'parameters': [35], 'technology.': [39], 'then': [41], ""model's"": [44], 'ability': [45], 'explain': [47], 'data.': [50], 'Our': [51], 'model': [53], 'generates': [54], 'total-factor-productivity': [56], '(TFP)': [57], 'elasticity': [58], 'output': [60, 91], 'per': [61, 92], 'worker': [62, 93], '2.8.': [64], 'This': [65], 'implies': [66], 'that': [67, 122, 166, 178], 'factor': [69, 86, 138], '3': [71], 'difference': [72, 89, 107], 'TFP': [74, 109, 167], 'is': [75, 110], 'amplified': [76], 'through': [77], 'physical': [78], 'accumulation': [82], 'generate': [84], '20': [88], '---': [94], 'as': [95], 'observed': [96], 'between': [100], 'rich': [101], 'poor': [103], 'countries.': [104], 'implied': [106, 147], 'range': [113], 'estimates': [115], 'from': [116, 155], 'micro': [117], 'studies.': [118], 'suggests': [121], 'using': [123], 'Mincer': [124], 'returns': [125], 'measure': [127], 'understates': [130], 'differences': [133, 143], 'across': [134], 'countries': [135], 'by': [136, 148], '2.': [140], 'consistent': [152], 'evidence': [154], 'earnings': [156], 'immigrants': [158], 'United': [161], 'States.': [162], 'also': [164], 'find': [165], 'has': [168], 'substantial': [169], 'effects': [170], 'on': [171], 'inequality': [173], 'intergenerational': [175], 'mobility': [176], 'public': [179], 'education': [180], 'policies': [181], 'can': [182], 'have': [183], 'important': [184], 'aggregate': [185], 'distributional': [187], 'implications.': [188]}",We develop a quantitative theory of human capital with heterogeneous agents in order to assess the sources of cross-country income differences. The cross-sectional implications of the theory and U.S. data are used to restrict the parameters of human capital technology. We then assess the model's ability to explain the cross-country data. Our quantitative model generates a total-factor-productivity (TFP) elasticity of output per worker of 2.8. This implies that a factor of 3 difference in TFP is amplified through physical and human capital accumulation to generate a factor of 20 difference in output per worker --- as observed in the data between rich and poor countries. The implied difference in TFP is in the range of estimates from micro studies. The theory suggests that using Mincer returns to measure human capital understates human capital differences across countries by a factor of 2. The cross-country differences in human capital implied by the theory are consistent with evidence from earnings of immigrants in the United States. We also find that TFP has substantial effects on cross-sectional inequality and intergenerational mobility and that public education policies can have important aggregate and distributional implications.,We develop a quantitative theory of human capital with heterogeneous agents in order to assess the sources of cross-country income differences. The cross-sectional implications of the theory and U.S. data are used to restrict the parameters of human capital technology. We then assess the model's ability to explain the cross-country data. Our quantitative model generates a total-factor-productivity (TFP) elasticity of output per worker of 2.8. This implies that a factor of 3 difference in TFP is amplified through physical and human capital accumulation to generate a factor of 20 difference in output per worker --- as observed in the data between rich and poor countries. The implied difference in TFP is in the range of estimates from micro studies. The theory suggests that using Mincer returns to measure human capital understates human capital differences across countries by a factor of 2. The cross-country differences in human capital implied by the theory are consistent with evidence from earnings of immigrants in the United States. We also find that TFP has substantial effects on cross-sectional inequality and intergenerational mobility and that public education policies can have important aggregate and distributional implications.,
https://openalex.org/W3217463473,"{'Theoretical': [0], 'and': [1, 42, 60, 100, 116, 122, 139, 144, 162], 'empirical': [2, 18, 72], 'studies': [3], 'exploring': [4], 'the': [5, 90, 107, 134, 145, 149, 158, 166], 'e§ects': [6], 'of': [7, 39, 44, 48, 81, 86, 92, 98, 103, 148, 160, 165], 'income': [8, 31, 137], 'in-\nequality': [9, 138], 'upon': [10], 'growth': [11, 52, 61, 140, 153], 'reach': [12], 'a': [13, 35, 87], 'disappointing': [14], 'inconclusive': [15], 'result.': [16], 'Some\nrecent': [17], 'papers': [19], 'have': [20], 'emphasized': [21], 'that': [22, 30, 170], 'one': [23], 'reason': [24], 'for': [25], 'this': [26, 70], 'ambi-\nguity': [27], 'could': [28], 'be': [29, 142, 155], 'inequality': [32, 38, 43, 49, 59, 82, 151, 164], 'is': [33, 66, 110, 172], 'actually': [34], 'composite': [36], 'measure\nof': [37], 'opportunity': [40], '(IO)': [41], 'e§ort': [45], '(IE).': [46], 'These\ntypes': [47], 'would': [50, 62], 'a§ect': [51, 118], 'through': [53], 'opposite': [54], 'channels,': [55], 'so\nthe': [56], 'relationship': [57, 135], 'between': [58, 136], 'depend': [63], 'on': [64, 69, 152, 157], 'which\ncomponent': [65], 'larger.': [67], 'Based': [68], 'preliminary': [71], 'result,': [73], 'we\nbuild': [74], 'an': [75], 'intergenerational': [76], 'model': [77, 109], 'with': [78], 'human': [79, 93, 119, 175, 186], 'capital': [80, 176, 187], 'and\ndevelopment.': [83], 'The': [84, 127], 'existence': [85], 'trap': [88], 'in': [89, 106, 131], 'process': [91], 'capi-\ntal': [94, 120], 'accumulation': [95, 121, 177], 'generates': [96], 'multiplicity': [97], 'equilibria': [99], 'permits': [101], 'the\ninclusion': [102], 'social': [104, 129], 'mobility': [105, 130], 'analysis.\nThe': [108], 'able': [111], 'to': [112, 141, 154, 174, 180], 'explain': [113], 'how': [114], 'IO': [115, 183], 'IE': [117, 171], 'hence': [123], 'ongoing': [124], 'long-run': [125], 'growth.': [126], 'existence\nof': [128], 'society': [132], 'makes': [133], 'non-linear,': [143], 'Onal': [146], 'sign': [147], 'inauence\nof': [150], 'dependent': [156], 'degree': [159], 'development': [161], 'overall': [163], 'economy.': [167], 'We': [168], 'Ond': [169], 'generally\nbeneOcial': [173], 'and,': [178], 'therefore,': [179], 'ongoing\ngrowth,': [181], 'while': [182], 'positively': [184], 'a§ects': [185], '(income)': [188], 'only': [189], 'for\nless': [190], 'developed': [191], 'economies': [192]}","Theoretical and empirical studies exploring the e§ects of income in-
equality upon growth reach a disappointing inconclusive result. Some
recent empirical papers have emphasized that one reason for this ambi-
guity could be that income inequality is actually a composite measure
of inequality of opportunity (IO) and inequality of e§ort (IE). These
types of inequality would a§ect growth through opposite channels, so
the relationship between inequality and growth would depend on which
component is larger. Based on this preliminary empirical result, we
build an intergenerational model with human capital of inequality and
development. The existence of a trap in the process of human capi-
tal accumulation generates multiplicity of equilibria and permits the
inclusion of social mobility in the analysis.
The model is able to explain how IO and IE a§ect human capi-
tal accumulation and hence ongoing long-run growth. The existence
of social mobility in society makes the relationship between income in-
equality and growth to be non-linear, and the Onal sign of the inauence
of inequality on growth to be dependent on the degree of development and overall inequality of the economy. We Ond that IE is generally
beneOcial to human capital accumulation and, therefore, to ongoing
growth, while IO positively a§ects human capital (income) only for
less developed economies","Theoretical and empirical studies exploring the e§ects of income in-
equality upon growth reach a disappointing inconclusive result. Some
recent empirical papers have emphasized that one reason for this ambi-
guity could be that income inequality is actually a composite measure
of inequality of opportunity (IO) and inequality of e§ort (IE). These
types of inequality would a§ect growth through opposite channels, so
the relationship between inequality and growth would depend on which
component is larger. Based on this preliminary empirical result, we
build an intergenerational model with human capital of inequality and
development. The existence of a trap in the process of human capi-
tal accumulation generates multiplicity of equilibria and permits the
inclusion of social mobility in the analysis.
The model is able to explain how IO and IE a§ect human capi-
tal accumulation and hence ongoing long-run growth. The existence
of social mobility in society makes the relationship between income in-
equality and growth to be non-linear, and the Onal sign of the inauence
of inequality on growth to be dependent on the degree of development and overall inequality of the economy. We Ond that IE is generally
beneOcial to human capital accumulation and, therefore, to ongoing
growth, while IO positively a§ects human capital (income) only for
less developed economies",
https://openalex.org/W4388724660,"{'We': [0], 'study': [1], 'the': [2, 12, 17, 23, 30, 43, 63, 68, 75, 79, 92, 101, 107, 109, 131, 145], 'intergenerational': [3], 'income': [4, 31, 76], 'mobility': [5, 84, 104], 'of': [6, 19, 25, 35, 62, 71, 133], 'individuals': [7], 'by': [8], 'directly': [9], 'comparing,': [10], 'for': [11], 'first': [13], 'time': [14], 'in': [15, 88, 91, 100, 125, 139, 144], 'France,': [16], 'rank': [18], 'young': [20, 64], 'adults': [21], 'between': [22], 'ages': [24], '27': [26], 'and': [27, 95, 113], '30': [28], 'on': [29, 39, 159], 'ladder': [32, 77], 'with': [33], 'that': [34], 'their': [36, 128], 'parents,': [37], 'based': [38], 'administrative': [40], 'data': [41], 'from': [42], 'Échantillon': [44], 'démogra': [45], 'phique': [46], 'permanent': [47], '(EDP,': [48], ""INSEE's"": [49], 'demographic': [50], 'panel': [51], 'sample).The': [52], 'rank-rank': [53], 'correlation': [54], 'is': [55, 86, 105], '0.25': [56], 'at': [57], 'age': [58, 132], '29.Twelve': [59], 'per': [60], 'cent': [61], 'people': [65], 'born': [66], 'to': [67, 78], 'poorest': [69], '20%': [70], 'parents': [72, 116, 150], 'climb': [73], 'up': [74], 'top': [80], '20%:': [81], 'this': [82], 'upward': [83, 160], 'rate': [85], 'higher': [87, 108], 'France': [89], 'than': [90, 99], 'United': [93], 'States': [94], 'Italy,': [96], 'but': [97], 'lower': [98], 'Nordic': [102], 'countries.Upward': [103], 'stronger': [106], ""parents'"": [110], 'capital': [111], 'incomes': [112], 'diploma,': [114], 'when': [115, 127], 'are': [117, 119, 152], 'immigrants,': [118], 'geographically': [120], 'mobile,': [121], 'or': [122, 143, 148], 'were': [123], 'living': [124], 'Île-de-France': [126], 'offspring': [129], 'reached': [130], 'majority.Conversely,': [134], 'being': [135], 'female,': [136], 'having': [137, 149], 'lived': [138], 'a': [140, 156], 'single-parent': [141], 'family': [142], 'Hauts-de-France': [146], 'region,': [147], 'who': [151], 'manual': [153], 'workers': [154], 'has': [155], 'negative': [157], 'impact': [158], 'mobility.': [161]}","We study the intergenerational income mobility of individuals by directly comparing, for the first time in France, the rank of young adults between the ages of 27 and 30 on the income ladder with that of their parents, based on administrative data from the Échantillon démogra phique permanent (EDP, INSEE's demographic panel sample).The rank-rank correlation is 0.25 at age 29.Twelve per cent of the young people born to the poorest 20% of parents climb up the income ladder to the top 20%: this upward mobility rate is higher in France than in the United States and Italy, but lower than in the Nordic countries.Upward mobility is stronger the higher the parents' capital incomes and diploma, when parents are immigrants, are geographically mobile, or were living in Île-de-France when their offspring reached the age of majority.Conversely, being female, having lived in a single-parent family or in the Hauts-de-France region, or having parents who are manual workers has a negative impact on upward mobility.","We study the intergenerational income mobility of individuals by directly comparing, for the first time in France, the rank of young adults between the ages of 27 and 30 on the income ladder with that of their parents, based on administrative data from the Échantillon démogra phique permanent (EDP, INSEE's demographic panel sample).The rank-rank correlation is 0.25 at age 29.Twelve per cent of the young people born to the poorest 20% of parents climb up the income ladder to the top 20%: this upward mobility rate is higher in France than in the United States and Italy, but lower than in the Nordic countries.Upward mobility is stronger the higher the parents' capital incomes and diploma, when parents are immigrants, are geographically mobile, or were living in Île-de-France when their offspring reached the age of majority.Conversely, being female, having lived in a single-parent family or in the Hauts-de-France region, or having parents who are manual workers has a negative impact on upward mobility.",Error fetching abstract
