id,abstract_inverted_index,abs,abstract,abstract_sm
https://openalex.org/W4233115133,"{'We': [0], 'conduct': [1], 'the': [2, 28, 42, 49], 'first': [3], 'dedicated': [4], 'study': [5], 'of': [6, 16, 45, 68], 'absolute': [7, 46], 'income': [8, 77, 93], 'mobility': [9, 47, 52, 72, 87], 'in': [10, 48, 71], 'Australia,': [11], 'for': [12, 36, 56, 97], '1950-2019.': [13], 'About': [14, 66], 'two-thirds': [15, 67], '30-34': [17], 'year-olds': [18], 'have': [19], 'higher': [20, 55, 61, 90], 'real': [21], 'incomes': [22, 62], 'than': [23, 63], 'their': [24, 64], 'parents': [25], 'did': [26], 'at': [27], 'same': [29], 'age,': [30], 'and': [31], 'this': [32, 69], 'has': [33], 'been': [34], 'stable': [35], '25': [37], 'years.': [38], 'This': [39], 'is': [40, 73, 81, 89, 94], 'among': [41], 'highest': [43], 'levels': [44], 'world.': [50], 'Nevertheless,': [51], 'was': [53], 'considerably': [54], 'baby-boomers': [57], '(over': [58], '80%': [59], 'had': [60], 'parents).': [65], 'decline': [70], 'due': [74, 82], 'to': [75, 83], 'lower': [76], 'growth.': [78], 'The': [79, 86], 'remainder': [80], 'rising': [84], 'inequality.': [85], 'estimate': [88], '(78%)': [91], 'when': [92], 'adjusted': [95], '(equivalised)': [96], 'family': [98], 'size.': [99]}","We conduct the first dedicated study of absolute income mobility in Australia, for 1950-2019. About two-thirds of 30-34 year-olds have higher real incomes than their parents did at the same age, and this has been stable for 25 years. This is among the highest levels of absolute mobility in the world. Nevertheless, mobility was considerably higher for baby-boomers (over 80% had higher incomes than their parents). About two-thirds of this decline in mobility is due to lower income growth. The remainder is due to rising inequality. The mobility estimate is higher (78%) when income is adjusted (equivalised) for family size.","We conduct the first dedicated study of absolute income mobility in Australia, for 1950-2019. About two-thirds of 30-34 year-olds have higher real incomes than their parents did at the same age, and this has been stable for 25 years. This is among the highest levels of absolute mobility in the world. Nevertheless, mobility was considerably higher for baby-boomers (over 80% had higher incomes than their parents). About two-thirds of this decline in mobility is due to lower income growth. The remainder is due to rising inequality. The mobility estimate is higher (78%) when income is adjusted (equivalised) for family size.",
https://openalex.org/W3166017557,"{'We': [0], 'conduct': [1], 'the': [2, 28, 42, 49], 'first': [3], 'dedicated': [4], 'study': [5], 'of': [6, 16, 45, 68], 'absolute': [7, 46], 'income': [8, 77, 93], 'mobility': [9, 47, 52, 72, 87], 'in': [10, 48, 71], 'Australia,': [11], 'for': [12, 36, 56, 97], '1950-2019.': [13], 'About': [14, 66], 'two-thirds': [15, 67], '30-34': [17], 'year-olds': [18], 'have': [19], 'higher': [20, 55, 61, 90], 'real': [21], 'incomes': [22, 62], 'than': [23, 63], 'their': [24, 64], 'parents': [25], 'did': [26], 'at': [27], 'same': [29], 'age,': [30], 'and': [31], 'this': [32, 69], 'has': [33], 'been': [34], 'stable': [35], '25': [37], 'years.': [38], 'This': [39], 'is': [40, 73, 81, 89, 94], 'among': [41], 'highest': [43], 'levels': [44], 'world.': [50], 'Nevertheless,': [51], 'was': [53], 'considerably': [54], 'baby-boomers': [57], '(over': [58], '80%': [59], 'had': [60], 'parents).': [65], 'decline': [70], 'due': [74, 82], 'to': [75, 83], 'lower': [76], 'growth.': [78], 'The': [79, 86], 'remainder': [80], 'rising': [84], 'inequality.': [85], 'estimate': [88], '(78%)': [91], 'when': [92], 'adjusted': [95], '(equivalised)': [96], 'family': [98], 'size.': [99]}","We conduct the first dedicated study of absolute income mobility in Australia, for 1950-2019. About two-thirds of 30-34 year-olds have higher real incomes than their parents did at the same age, and this has been stable for 25 years. This is among the highest levels of absolute mobility in the world. Nevertheless, mobility was considerably higher for baby-boomers (over 80% had higher incomes than their parents). About two-thirds of this decline in mobility is due to lower income growth. The remainder is due to rising inequality. The mobility estimate is higher (78%) when income is adjusted (equivalised) for family size.","We conduct the first dedicated study of absolute income mobility in Australia, for 1950-2019. About two-thirds of 30-34 year-olds have higher real incomes than their parents did at the same age, and this has been stable for 25 years. This is among the highest levels of absolute mobility in the world. Nevertheless, mobility was considerably higher for baby-boomers (over 80% had higher incomes than their parents). About two-thirds of this decline in mobility is due to lower income growth. The remainder is due to rising inequality. The mobility estimate is higher (78%) when income is adjusted (equivalised) for family size.","We conduct the first dedicated study of absolute income mobility in Australia, for 1950-2019. About two-thirds of 30-34 year-olds have higher real incomes than their parents did at the same age, and this has been stable for 25 years. This is among the highest levels of absolute mobility in the world. Nevertheless, mobility was considerably higher for baby-boomers (over 80% had higher incomes than their parents). About two-thirds of this decline in mobility is due to lower income growth. The remainder is due to rising inequality. The mobility estimate is higher (78%) when income is adjusted (equivalised) for family size."
https://openalex.org/W1515099207,"{'We': [0, 40, 163], 'develop': [1], 'a': [2, 55, 68, 85, 137], 'quantitative': [3, 52], 'theory': [4, 26, 120, 150], 'of': [5, 17, 24, 36, 59, 63, 70, 87, 114, 139, 157], 'human': [6, 37, 80, 128, 131, 145], 'capital': [7, 38, 81, 129, 132, 146], 'with': [8, 153], 'heterogeneous': [9], 'agents': [10], 'in': [11, 73, 90, 97, 108, 111, 144, 159], 'order': [12], 'to': [13, 32, 46, 83, 126], 'assess': [14, 42], 'the': [15, 25, 34, 43, 48, 98, 112, 149, 160], 'sources': [16], 'cross-country': [18, 49, 142], 'income': [19], 'differences.': [20], 'The': [21, 105, 119, 141], 'cross-sectional': [22, 172], 'implications': [23], 'and': [27, 79, 102, 174, 177, 186], 'U.S.': [28], 'data': [29, 99], 'are': [30, 151], 'used': [31], 'restrict': [33], 'parameters': [35], 'technology.': [39], 'then': [41], ""model's"": [44], 'ability': [45], 'explain': [47], 'data.': [50], 'Our': [51], 'model': [53], 'generates': [54], 'total-factor-productivity': [56], '(TFP)': [57], 'elasticity': [58], 'output': [60, 91], 'per': [61, 92], 'worker': [62, 93], '2.8.': [64], 'This': [65], 'implies': [66], 'that': [67, 122, 166, 178], 'factor': [69, 86, 138], '3': [71], 'difference': [72, 89, 107], 'TFP': [74, 109, 167], 'is': [75, 110], 'amplified': [76], 'through': [77], 'physical': [78], 'accumulation': [82], 'generate': [84], '20': [88], '---': [94], 'as': [95], 'observed': [96], 'between': [100], 'rich': [101], 'poor': [103], 'countries.': [104], 'implied': [106, 147], 'range': [113], 'estimates': [115], 'from': [116, 155], 'micro': [117], 'studies.': [118], 'suggests': [121], 'using': [123], 'Mincer': [124], 'returns': [125], 'measure': [127], 'understates': [130], 'differences': [133, 143], 'across': [134], 'countries': [135], 'by': [136, 148], '2.': [140], 'consistent': [152], 'evidence': [154], 'earnings': [156], 'immigrants': [158], 'United': [161], 'States.': [162], 'also': [164], 'find': [165], 'has': [168], 'substantial': [169], 'effects': [170], 'on': [171], 'inequality': [173], 'intergenerational': [175], 'mobility': [176], 'public': [179], 'education': [180], 'policies': [181], 'can': [182], 'have': [183], 'important': [184], 'aggregate': [185], 'distributional': [187], 'implications.': [188]}",We develop a quantitative theory of human capital with heterogeneous agents in order to assess the sources of cross-country income differences. The cross-sectional implications of the theory and U.S. data are used to restrict the parameters of human capital technology. We then assess the model's ability to explain the cross-country data. Our quantitative model generates a total-factor-productivity (TFP) elasticity of output per worker of 2.8. This implies that a factor of 3 difference in TFP is amplified through physical and human capital accumulation to generate a factor of 20 difference in output per worker --- as observed in the data between rich and poor countries. The implied difference in TFP is in the range of estimates from micro studies. The theory suggests that using Mincer returns to measure human capital understates human capital differences across countries by a factor of 2. The cross-country differences in human capital implied by the theory are consistent with evidence from earnings of immigrants in the United States. We also find that TFP has substantial effects on cross-sectional inequality and intergenerational mobility and that public education policies can have important aggregate and distributional implications.,We develop a quantitative theory of human capital with heterogeneous agents in order to assess the sources of cross-country income differences. The cross-sectional implications of the theory and U.S. data are used to restrict the parameters of human capital technology. We then assess the model's ability to explain the cross-country data. Our quantitative model generates a total-factor-productivity (TFP) elasticity of output per worker of 2.8. This implies that a factor of 3 difference in TFP is amplified through physical and human capital accumulation to generate a factor of 20 difference in output per worker --- as observed in the data between rich and poor countries. The implied difference in TFP is in the range of estimates from micro studies. The theory suggests that using Mincer returns to measure human capital understates human capital differences across countries by a factor of 2. The cross-country differences in human capital implied by the theory are consistent with evidence from earnings of immigrants in the United States. We also find that TFP has substantial effects on cross-sectional inequality and intergenerational mobility and that public education policies can have important aggregate and distributional implications.,We develop a quantitative theory of human capital with heterogeneous agents in order to assess the sources of cross-country income differences. The cross-sectional implications of the theory and U.S. data are used to restrict the parameters of human capital technology. We then assess the model's ability to explain the cross-country data. Our quantitative model generates a total-factor-productivity (TFP) elasticity of output per worker of 2.8. This implies that a factor of 3 difference in TFP is amplified through physical and human capital accumulation to generate a factor of 20 difference in output per worker --- as observed in the data between rich and poor countries. The implied difference in TFP is in the range of estimates from micro studies. The theory suggests that using Mincer returns to measure human capital understates human capital differences across countries by a factor of 2. The cross-country differences in human capital implied by the theory are consistent with evidence from earnings of immigrants in the United States. We also find that TFP has substantial effects on cross-sectional inequality and intergenerational mobility and that public education policies can have important aggregate and distributional implications.
https://openalex.org/W1549216283,"{'This': [0, 163], 'dissertation': [1], 'consists': [2], 'of': [3, 54, 78, 95, 114, 134, 149, 169, 186, 202, 210, 244, 256, 258, 272, 304, 332, 354, 393], 'three': [4, 26], 'essays,': [5], 'taking': [6], 'different': [7], 'perspectives': [8], 'on': [9, 28, 46, 151, 213, 234, 253, 269, 402], 'human': [10, 17, 58, 69, 109, 183, 308], 'capital.': [11, 110], 'The': [12, 315, 371, 391], 'first': [13, 39], 'essay': [14, 40, 300, 345], 'looks': [15], 'at': [16], 'capital': [18, 59, 70, 116, 136, 184, 197, 309], 'from': [19, 356, 387], 'a': [20, 131, 245, 302, 406], 'growth': [21, 50, 100, 139], 'perspective.': [22], 'Essays': [23], 'two': [24], 'and': [25, 33, 51, 60, 80, 215, 228, 249, 265, 268, 286, 297, 307, 313, 334, 399], 'focuses': [27], 'the': [29, 44, 55, 76, 93, 104, 118, 127, 143, 146, 152, 167, 208, 242, 254, 270, 293, 394], 'individual’s': [30], 'occupational': [31, 200, 236, 305, 322], 'decision': [32], 'its': [34, 124, 232], 'relation': [35], 'to': [36, 42, 107, 120, 126, 159, 175, 180, 181, 196, 204, 262, 320, 326, 338, 341, 363, 380], 'family': [37, 176, 318], 'background.The': [38], 'attempts': [41], 'capture': [43], 'effects': [45, 209], 'long': [47, 98], 'run': [48, 99], 'economic': [49, 327, 364, 381], 'transitional': [52], 'dynamics': [53], 'interaction': [56], 'between': [57, 247], 'R&D.': [61, 88], 'We': [62, 89, 206], 'do': [63, 87], 'this': [64, 189], 'by': [65, 103], 'allowing': [66], 'for': [67, 225, 292, 295, 414], 'endogenous': [68], 'accumulation': [71], 'in': [72, 92, 157, 194, 330, 344], 'an': [73, 281], 'economy': [74, 119], 'where': [75], 'number': [77], 'products': [79], 'technologies': [81], 'expands': [82], 'because': [83], 'profit': [84], 'maximizing': [85], 'entrepreneurs': [86], 'find': [90], 'that,': [91], 'absence': [94], 'scale': [96], 'effects,': [97], 'is': [101, 155, 164, 173, 219, 289, 311, 348, 360, 369], 'determined': [102], 'economy’s': [105], 'capacity': [106], 'accumulate': [108], 'A': [111], 'relative': [112, 132], 'lack': [113], 'R&D': [115, 135], 'causes': [117], 'grow': [121], 'slowly': [122], 'during': [123, 141], 'transition': [125], 'steady': [128], 'state,': [129], 'while': [130], 'abundance': [133], 'gives': [137], 'high': [138], 'rates': [140], 'transition.In': [142], 'second': [144], 'essay,': [145], 'classical': [147], 'Roy-model': [148], 'selection': [150], 'labor': [153], 'market': [154], 'extended': [156], 'order': [158], 'analyze': [160], 'intergenerational': [161, 187, 226, 250], 'mobility.': [162], 'done': [165], 'through': [166, 231, 324], 'introduction': [168], 'ability': [170, 263, 335, 416], 'uncertainty': [171, 336], 'that': [172, 221, 241, 342, 350, 375], 'linked': [174, 337], 'background.': [177], 'In': [178], 'contrast': [179], 'additional': [182], 'models': [185], 'mobility,': [188], 'mechanism': [190], 'rather': [191], 'than': [192], 'differences': [193, 329], 'access': [195, 325], 'markets': [198], 'links': [199], 'oucomes': [201], 'offspring': [203], 'parents.': [205], 'study': [207], 'income': [211], 'redistribution': [212, 222, 248, 277], 'mobility': [214, 227, 251, 296], 'talent': [216, 229, 298], 'allocation.': [217], 'It': [218, 347], 'found': [220], 'has': [223], 'implications': [224, 392], 'allocation': [230], 'influence': [233, 321], 'individual': [235, 273], 'choices.': [237], 'However,': [238], 'we': [239], 'conclude': [240], 'presence': [243], 'trade-off': [246], 'depends': [252], 'extent': [255], 'similarity': [257], 'occupations': [259, 288, 385], 'with': [260], 'regard': [261], 'sensitivity': [264], 'wage': [266], 'rates,': [267], 'degree': [271], 'risk': [274, 367], 'aversion.': [275], 'Whether': [276], 'occurs': [278], 'only': [279], 'within': [280, 285], 'occupation': [282], 'or': [283], 'simultaneously': [284], 'across': [287], 'also': [290, 373], 'inportant': [291], 'implicatons': [294], 'allocation.In': [299], 'three,': [301], 'model': [303, 316, 372, 396], 'choice': [306, 323], 'investment': [310], 'developmed': [312], 'tested.': [314], 'allows': [317], 'background': [319, 339, 359], 'resources,': [328], 'costs': [331], 'schooling,': [333], 'similar': [340], 'discussed': [343], 'two.': [346], 'predicted': [349], 'life': [351], 'time': [352], 'utility': [353], 'children': [355], 'less': [357], 'well-off': [358], 'more': [361, 378], 'sensitive': [362, 379], 'incentives': [365, 382], 'when': [366, 383], 'aversion': [368], 'strong.': [370], 'predicts': [374], 'people': [376], 'are': [377, 397], 'considering': [384], 'distant': [386], 'their': [388], 'parent': [389], 'occuations.': [390], 'theoretical': [395], 'tested': [398], 'largely': [400], 'confirmed': [401], 'Swedish': [403], 'data': [404], 'using': [405], 'mixed': [407], 'multinominal': [408], 'logit': [409], 'framework': [410], 'which': [411], 'explicitly': [412], 'accounts': [413], 'unobserved': [415], 'heterogeneity.': [417]}","This dissertation consists of three essays, taking different perspectives on human capital. The first essay looks at human capital from a growth perspective. Essays two and three focuses on the individual’s occupational decision and its relation to family background.The first essay attempts to capture the effects on long run economic growth and transitional dynamics of the interaction between human capital and R&D. We do this by allowing for endogenous human capital accumulation in an economy where the number of products and technologies expands because profit maximizing entrepreneurs do R&D. We find that, in the absence of scale effects, long run growth is determined by the economy’s capacity to accumulate human capital. A relative lack of R&D capital causes the economy to grow slowly during its transition to the steady state, while a relative abundance of R&D capital gives high growth rates during transition.In the second essay, the classical Roy-model of selection on the labor market is extended in order to analyze intergenerational mobility. This is done through the introduction of ability uncertainty that is linked to family background. In contrast to to additional human capital models of intergenerational mobility, this mechanism rather than differences in access to capital markets links occupational oucomes of offspring to parents. We study the effects of income redistribution on mobility and talent allocation. It is found that redistribution has implications for intergenerational mobility and talent allocation through its influence on individual occupational choices. However, we conclude that the presence of a trade-off between redistribution and intergenerational mobility depends on the extent of similarity of occupations with regard to ability sensitivity and wage rates, and on the degree of individual risk aversion. Whether redistribution occurs only within an occupation or simultaneously within and across occupations is also inportant for the implicatons for mobility and talent allocation.In essay three, a model of occupational choice and human capital investment is developmed and tested. The model allows family background to influence occupational choice through access to economic resources, differences in costs of schooling, and ability uncertainty linked to background similar to that discussed in essay two. It is predicted that life time utility of children from less well-off background is more sensitive to economic incentives when risk aversion is strong. The model also predicts that people are more sensitive to economic incentives when considering occupations distant from their parent occuations. The implications of the theoretical model are tested and largely confirmed on Swedish data using a mixed multinominal logit framework which explicitly accounts for unobserved ability heterogeneity.","This dissertation consists of three essays, taking different perspectives on human capital. The first essay looks at human capital from a growth perspective. Essays two and three focuses on the individual’s occupational decision and its relation to family background.The first essay attempts to capture the effects on long run economic growth and transitional dynamics of the interaction between human capital and R&D. We do this by allowing for endogenous human capital accumulation in an economy where the number of products and technologies expands because profit maximizing entrepreneurs do R&D. We find that, in the absence of scale effects, long run growth is determined by the economy’s capacity to accumulate human capital. A relative lack of R&D capital causes the economy to grow slowly during its transition to the steady state, while a relative abundance of R&D capital gives high growth rates during transition.In the second essay, the classical Roy-model of selection on the labor market is extended in order to analyze intergenerational mobility. This is done through the introduction of ability uncertainty that is linked to family background. In contrast to to additional human capital models of intergenerational mobility, this mechanism rather than differences in access to capital markets links occupational oucomes of offspring to parents. We study the effects of income redistribution on mobility and talent allocation. It is found that redistribution has implications for intergenerational mobility and talent allocation through its influence on individual occupational choices. However, we conclude that the presence of a trade-off between redistribution and intergenerational mobility depends on the extent of similarity of occupations with regard to ability sensitivity and wage rates, and on the degree of individual risk aversion. Whether redistribution occurs only within an occupation or simultaneously within and across occupations is also inportant for the implicatons for mobility and talent allocation.In essay three, a model of occupational choice and human capital investment is developmed and tested. The model allows family background to influence occupational choice through access to economic resources, differences in costs of schooling, and ability uncertainty linked to background similar to that discussed in essay two. It is predicted that life time utility of children from less well-off background is more sensitive to economic incentives when risk aversion is strong. The model also predicts that people are more sensitive to economic incentives when considering occupations distant from their parent occuations. The implications of the theoretical model are tested and largely confirmed on Swedish data using a mixed multinominal logit framework which explicitly accounts for unobserved ability heterogeneity.",
